{
  "canal": "instagram",
  "linha_dl": "DL Volt",
  "publico": "administradoras de condomínios no Rio de Janeiro",
  "formato": "feed",
  "tema": "Manutenção preventiva de quadros elétricos em condomínios",
  "objetivo": "Gerar demanda para Avaliação Técnica de infraestrutura elétrica",
  "legenda_facebook": "",
  "legenda_instagram": "Seu condomínio apresenta disjuntores que desarmam com frequência, fios com coloração alterada ou ruídos estranhos no quadro elétrico? Esses podem ser sinais de que a infraestrutura elétrica precisa de atenção.\n\nEm edificações com mais de 15 anos, é comum que os quadros de distribuição operem fora das normas atuais. Componentes envelhecidos, conexões oxidadas e dimensionamento inadequado para a demanda atual podem representar riscos reais para a segurança dos moradores e para o patrimônio.\n\nA manutenção preventiva é a abordagem mais inteligente: identifica problemas antes que se tornem emergências, evita interrupções no fornecimento de energia e mantém o condomínio em conformidade com as normas técnicas vigentes.\n\nA DL Volt, linha de infraestrutura elétrica da DL Soluções Condominiais, realiza avaliações técnicas completas dos quadros elétricos e da infraestrutura de distribuição do seu condomínio.\n\n⚡ Envie uma mensagem para a DL e agende a Avaliação Técnica do quadro elétrico do seu condomínio.\n\n#DLVolt #EletricaCondominial #ManutencaoPreventiva #QuadroEletrico #SindicosRJ #DLSolucoes",
  "cta": "Envie uma mensagem para a DL e agende a Avaliação Técnica do quadro elétrico do seu condomínio.",
  "hashtags": [
    "#DLVolt",
    "#EletricaCondominial",
    "#ManutencaoPreventiva",
    "#QuadroEletrico",
    "#SindicosRJ",
    "#DLSolucoes"
  ],
  "image_prompt_en": "Photorealistic vertical 9:16 image of a modern well-organized electrical panel in a condominium utility room, clean wiring with proper labeling, professional electrician tools nearby, bright fluorescent lighting, industrial clean aesthetic, no visible faces, no readable personal information, Canon R5, 24mm wide angle, sharp focus, professional documentation photography",
  "alt_text": "Quadro elétrico moderno e organizado em sala técnica de condomínio, com fiação limpa e identificada e ferramentas profissionais de eletricista ao lado.",
  "risco_meta": "baixo",
  "precisa_aprovacao_humana": false,
  "motivo_aprovacao_humana": "",
  "aprovado_pre_killcritic": true,
  "aprovado_killcritic": true,
  "status_killcritic": "APROVADO",
  "motivos_bloqueio": [],
  "ajustes_recomendados": [],
  "image_url_publica_meta": "https://example.com/dl_volt_quadro.jpg",
  "google_drive_file_id": "",
  "google_drive_web_view_link": "",
  "tem_direito_uso_midia": true,
  "status_publicacao": "pendente",
  "post_id": "",
  "media_id": "",
  "permalink": "",
  "erro_meta": "",
  "id_execucao_n8n": "",
  "fonte_noticia": "",
  "carrossel_slides": []
}
